ID,variations,Keywords,Volume
1,"pickup lines, best pickup lines, hook up lines, chat up lines, dirty chat up lines, flirt lines, hookup pickup lines, bad pickup lines, flirty chat up lines, online flirting lines, ai pickup lines, poop pickup lines, good flirting lines, 18 pickup lines, 2022 best pickup lines, 2022 pickup lines",pickup lines,784765
0,"cheesy pick up lines, good pick up lines, corny pick up lines, dirty pick up lines, funny pick up lines, pick up lines for flirting, cute pick up lines, pick up lines for guys, electrician pick up lines, lord of the rings pick up lines, smooth pick up lines, great pick up lines, cringy pick up lines, cheesy pick up lines for her, funny pick up lines for her, pick up lines for dating apps, lotr pick up lines, pick up lines for flirting with guys, therapist pick up lines, hot pick up lines, cheesy pick up lines for him, good pick up lines for guys, cheesiest pick up lines, halloween pick up lines, funny pick up lines for him, cringe pick up lines, dentist pick up lines, one night stand pick up lines, romantic pick up lines, christian pick up lines, handyman pick up lines, clever pick up lines, online dating pick up lines, cringey pick up lines, smooth pick up lines for her, corny pick up lines for her, bible pick up lines, pick up lines to make him blush, disney pick up lines, science pick up lines, grocery store pick up lines, pick up lines for her, insurance pick up lines, amazing pick up lines, pick up lines to use on guys, top pick up lines, corny pick up lines for him, online pick up lines, 10 10 pick up lines, 10 pick up lines, 100 cheesy pick up lines, 100 pick up lines, 100 pick up lines for her, 100 worst pick up lines, 18 pick up lines, 2 line pick up lines, 20 pick up lines, 2022 pick up lines",cheesy pick up lines,701330
4,"tinder pickup lines, best tinder pick up lines, tinder chat up lines, tinder pickup lines for hookups, good tinder pick up lines, tinder pick up lines to get laid, pick up lines for hookups",tinder pickup lines,98963
3,"sexy pick up lines, sexy chat up lines",sexy pick up lines,33696
2,"best hookup lines, best one night stand pick up lines, best flirting lines, best chat up lines, best pick up lines for guys, best hookup pick up lines, best dating app pick up lines, best online pick up lines, best flirty pick up lines, best cheesy pick up lines, 10 best pick up lines, 100 best pick up lines, 101 best pick up lines, 101 cheesy pick up lines, 101 pick up lines, 40 best pick up lines",best hookup lines,13877
